first_author_last_name,year,city,country,study_design,intervention,metric,type of measure,measure,equity_group1,equity1_sample_size,equity_group2,equity2_sample_size,comparison_group,comparison_sample,comparison_group1,comparison_sample1,reliability,reliability_finding,validity,validity_finding,analysis,results ,conclusions,link_to_measure,notes
Oyeyemi,2017,Several cities,"Cameroon, Ghana, Mozambique, Nigeria, South Africa and Uganda",cross-sectional,NA,walkability,self-report,NEWS-Africa,Residents of disadvantaged nbg,NA,Residents of rural villages,NA,NA,NA,NA,NA,Yes (from another paper by same authors),The scales and individual items of NEWS-Africa have evidence of “good” (ICCs=0.60 - 0.74) to “excellent” (ICCs>0.75%) test-retest reliability,Yes (Construct),"Six of 13 NEWS-Africa subscales were significantly associated with either walking for transport or for recreation. The overall walkability index was significantly related to both walking for transport and for recreation in pooled analyses. The effect sizes were small, with NEWS-Africa scores accounting for 1% - 2% of variance in walking for both purposes in the pooled analyses.",GLM,"See ""validity finding""","Seven of 14 NEWS-Africa scales were significantly related to walking behavior in pooled analyses, providing partial support for the construct validity of NEWS-Africa. However, effect sizes appeared to be lower than those from other continents.",https://www.ncbi.nlm.nih.gov/pmc/articles/PMC4782343/?report=reader,"- Two studies have provided partial support for the feasibility of using the NEWS questionnaire in Africa by reporting acceptable psychometric properties for its original subscales in Nigerian adults (24) and modest correlations between its subscales and accelerometer and self-reported estimates of physical activity in South African older adults (18). 
- Recently, the NEWS was systematically adapted for Africa through a coordinated study in multiple African countries (23). The test-retest reliability of the resulting NEWS-Africa instrument was “good” (ICCs=0.60 to 0.74) to “excellent” (ICCs>0.75%) for over 90% of its items and scales.
- INCLUDE PAPER ON TEST-RETEST RELIABILITY IN TABLE TOO? https://www.ncbi.nlm.nih.gov/pmc/articles/PMC4782343/?report=reader#__ffn_sectitle"
Child,2016,1 central South Carolina county,USA,cross-sectional,walking intervention (baseline survey only),walkability/bikeability/active living,self-report,"International Physical Activity Questionnaire - Environment module (IPAQ-E): accessibility (high dwelling density, destinations within walking distance); structural support (presence of sidewalks, sidewalks are maintained, presence of bicycle facilities, facilities for bicycling are maintained, presence of low-cost recreation facilities, high street connectivity); safety (crime in day prevents walking, crime at night prevents walking, traffic is barrier to walking, traffic is varrier to bicycling); cues and motivators (presence of active others, positive nbg aesthetics)",NA,NA,NA,NA,NA,NA,NA,NA,no,NA,no,NA,Multiple regression between built and social environment indicators,"Selected neighbourhood attributes were positively associated with social cohesion, participants' neighbourhood interactions (e.g., waving a tneighbours), and social support for PA from family and friends (see Table 2 for detailed results)","Several neighborhood attributes related to
accessibility and all of the structural
support features (e.g., sidewalks, desti-
nations within walking distance) were
associated with social interactions with
neighbors, highlighting that features
conducive to PA may also facilitate
social connections and support. ",https://www.researchgate.net/profile/Patrick-Bergman-2/publication/225319257_IPAQ_Environmental_Module_reliability_testing/links/620f40d76c472329dcf11df6/IPAQ-Environmental-Module-reliability-testing.pdf,"Test-retest reliability of Swedish version was assessed in other paper (DOI 10.1007/s10389-005-0016-2): Percent agreement ranged from 51–90% for men and 51–98% for women. The lowest values were seen for the questions regarding the social environment and street connectivity (both variables=51%). The highest percent agreement for men and women was seen for the question regarding the number of motorized vehicles in the household (89.9 and 95.9%, respectively). ICC ranged from 0.41–0.96 for men and from 0.27–0.98 for women. Again the highest numbers were seen for the questions regarding motorized vehicles (ICC=0.98) and type of housing  (ICC=0.96). The variable demonstrating the lowest ICC for men was transit stop within a 10- to 15-min walking distance. Crime rate during the day resulted in the lowest reliability score for women (ICC=0.36)"
Alexander,2013,,USA,cross-sectional,Park Access,Green Space,parent self-report,"“Please tell me if the following places and things are available to your children in your neighborhood, even if [CHILD'S NAME] does not actually use them: 1) A park or playground area; and 2) A recreation center, community center, or boys’ or girls’ club”. Parents self-reported whether a park, playground area, recreation centre, community centre, or boys’/girls’ club was available in the neighbourhood.",Non-Hispanic Black,4310,Hispanic,4134,Non-Hispanic White,30415,,,no,NA,no,NA,Mediation analysis with race/ethnicity as effect modifier. ,"Race/ethnicity was an effect modifier of the access to recreational parks and facilities—obesity association (Breslow-Day test of homogeneity p<0.0001). Among Non-Hispanic White children, those who had access to recreational parks and facilities had 0.89 times the prevalence of obesity as compared to children without access (95% CI 0.64 to 1.23). Findings were similar among both Hispanic and ‘Other’ children (PR=0.73, 95% CI 0.28 to 1.81 and PR=0.80, 95% CI 0.23 to 2.28, respectively).",,No link. Very simple single question. ,
Blair,2019,,Scotland,cross-sectional,Park Access,Green Space,self-report,"“Is there a public park or play park within 10 min walk of here [your residence]?” Those who reported “Yes” were considered to have access to a local park, while those reporting “No” were not.",,,,,,,,,,,,,Mediation analysis using park access a mediator between adverse childhood experience and low income. ,"Statistically significant associations between parks, childcare, and ACE incidence were not observed.","Of the resources assessed, only transportation was associated with lower ACE incidence in households above and below the poverty line. We estimated that a substantial portion (21%) of the income-based inequality in the 8-year cumulative incidence of three or more ACEs could be eliminated if all had access to adequate transportation.",No link. Very simple single question. ,
Chen,2020,"Beijing, Shannxi, Guangdong",China,cross-sectional,Park Access,Green Space,,"For the green space attributes, participants were asked whether green space access (e.g., walking distance and road system), type (e.g., green space in residential areas and multifunctional parks) or size (e.g., 1, 2 and 5 Ha) played a role in respondents’ health promotion. The landscape characteristics were measured by asking whether plants (e.g., ornamental features and canopy density), water (e.g., artificial and natural), sensory features (e.g., sound and smell) or microclimate environments (e.g., temperature and humidity) contributed to health promotion. The facilities were assessed by asking respondents whether rest facilities (e.g., seats and pergolas with chairs) or amenity facilities (e.g., exercise facilities, running paths, swings and slides) had an impact on their health promotion. All the response options were listed on a Likert scale (1 = strongly disagree to 5 = strongly agree).",,,,,,,,,"Cronbach’s α values for the willingness to use parks to promote health and the park use behavior were 0.836 and 0.712, respectively",,"CR coefficients for each independent variable exceeded the threshold value of 0.7 [97] and average variance extracted (AVE) scores were calculated with values higher than 0.5 in Table 1 [98], indicating that the results were acceptable.",,Linear regression,"Green space access (β = 0.289, p < 0.01), type (β = 0.109, p < 0.01), size (β = 0.179, p < 0.01), sensory features (β = 0.129, p < 0.01) and amenity facilities (β = 0.079, p < 0.05) exerted a significant positive influence on the willingness to use parks to promote physical health.","Overall, our findings demonstrated that young residents’ perception of green space components for health promotion had a greater effect on their willingness to use parks to promote health and the perception of access to green space access was the most robust predictor of willingness.",No specific detail about the extact questions. Would have to recreate. ,
Chen,2019,Cache County,USA,cross-sectional,,Green Space,audit,"PARK (Parks, Activity, and Recreation among Kids)",,,,,,,,,,,,,Spatial OLS with queen contiguity,"Regarding issues of environmental justice, differences in SES across communities may lead to variations of park quality, resulting in unequal distribution of public resources. Some SES factors have significant associations with park quality. A negative relationship between poverty and overall park quality indicates that as the percentage of people living under the 125% federal poverty line increased, the overall park quality in their communities decreased","The improvement of park quality provides greater opportunity for experiencing equitable access to the pursuit of healthy and productive lifestyles,",https://link-springer-com.cyber.usask.ca/article/10.1007/s10980-019-00891-y,
Cohen,2016,Pittsburgh,USA,cross-sectional,Park Use,Green Space,audit,System for Observing Play and Recreation in Communities (SOPARC),Food Desert Parks,19 parks,,,Comparison Parks in Pittsburg,182,,,,,,,Eyeball comparison of means. Not clear if there is any statistical analysis,"Of the 6825 observations, supervised or organized activities were observed 62 times—fewer than 1 % of all observations. This compares to 4 % in the national sample. Moderate to a lot of litter was observed in 25 % of all observations, less than the 32 % nationally. Graffiti was more likely to be seen in the smaller parks than those with less than 2 acres (12.5 % versus 9 %). All the target areas in all the parks were rated as usable","It is possible that small investments in park renovations and programming could make a substantial impact on population physical activity and health. Most parks are designed generically, but given different local needs, park administrators should do their utmost to ensure that park resources are not wasted and can truly serve the residents for whom they are intended.",https://www-ncbi-nlm-nih-gov.cyber.usask.ca/pmc/articles/PMC2957838/,
Derose,2019,Los Angeles,USA,cross-sectional,Park Use,Green Space,audit,System for Observing Play and Recreation in Communities (SOPARC),Sample is in low income parks only,,Gender,,,,,,,,,,Mediation analysis. Gender - Crime perception - Park Use,"For park visits in the last 7 days, perceived crime partially mediated the gender association (βgender, direct= −0.09, p=0.19; βgender, indirect = −0.07, p<.0001) and that of the walking path (βwalking path, direct=0.18, p=0.10; βwalking path, indirect=0.15, p=0.005), where indirect associations were large and significant and direct associations were not significant. This result suggests that gender and the existence of a walking path influenced park visits partially through perceived crime.","Among park users in high poverty neighborhoods, most of whom were Latino, addressing crime concerns are likely necessary to increase park use among women and adults whose parks do not have a walking path.",https://www-ncbi-nlm-nih-gov.cyber.usask.ca/pmc/articles/PMC2957838/,
Derose,2018,Los Angeles,USA,cross-sectional,Park Use,Green Space,audit,System for Observing Play and Recreation in Communities (SOPARC),Sample is in low income parks only,,Gender,,,,,,,,,,3 level Mutilevel model (individuals in parks in neighbourhoods).,"Compared to men, women reported fewer park visits in the past week (−0.28 times/week, p<.001) and shorter durations of a typical park visit (−11.11 minutes/visit, p<.001). African Americans had 23 percentage points lower probability of exercising in the park (p<.001) and 26 percentage points lower probability of exercising elsewhere than white/Asian/other (p<.001). Latinos had 21 and 22 percentage points lower probability of exercising in the park and elsewhere, respectively, than white/Asian/other (p<.001).","Despite similar proximity to parks and controlling for a range of individual, park- and neighborhood-level factors, women in high-poverty neighborhoods experience consistent disparities in park use and PA as compared to men.",https://www-ncbi-nlm-nih-gov.cyber.usask.ca/pmc/articles/PMC2957838/,
Feng,2017,,Australia,longitudinal (5 time points),Park Access,Green Space,self-report,"Question: There are good parks, playgrounds and play spaces in this neighborhood. Response options: strongly agreed, agreed, disagreed, or strongly disagreed.",,,,,,,,,,,,,3 level Mutilevel model (time in individuals in neighbourhoods).,"A stronger dose–response was also observed by green space quality, with well-being across each indicator demonstrably more favorable among children whose parents perceived local green spaces to be of higher quality.",More detailed longitudinal studies of green space quality in relation to child well-being and development are needed.,,
Fontán-Vela,2021,Madrid,Spain,cross-sectional,Park Use,Green Space,audit,System for Observing Play and Recreation in Communities (SOPARC),Gender of Park Users,,,,,,,,,,,,,Differences in the proportion by gender performing high PA differed by NSES: these were higher in the high-NSES (15.1% males vs 8.9% females) compared to the low-NSES where proportions were more comparable (3.6% males vs 2.8% females).,"Parks were more visited in the high-NSES neighborhood, where a higher proportion of people performed high physical activity (as compared with residents in the middle- and low-NSES areas).",https://www-ncbi-nlm-nih-gov.cyber.usask.ca/pmc/articles/PMC2957838/,
Gallo,2015,Newcastle upon Tyne,UK,cross-sectional,Park Use,Green Space,audit,Observational Park Audit Tool (OPAT),Low income park,,,,High income park,,,,,,,,Comparisons between many factors,"Significant physical environment differences were observed between case study parks. Environmen- tal diversity favoured Eastern (deprived area); maintenance, absence of anti-social behaviour and aesthetics favoured Southville (affluent area); and exercise facilities and park amenities did not defi- nitively favour either park","While factors influencing park use and young people’s activity were not fully explained in this study, evidence suggests the importance of environmental diversity, exercise facilities and/ or amenities and safety over that of maintenance and aesthetic variables.",Can't find it and there is no citation in the paper,
Hoffimann,2017,Porto,Portugal,cross-sectional,Park Use,Green Space,audit,"Public Open Space Tool. 32 out of the 49 items from POST. We excluded items that were absent 
(e.g., barbecue area, dog fountains) and/or present (e.g., presence 
trees, access to public transport) in all green spaces, as they did not 
discriminate green spaces, and items with an unpredictable impact in 
green space use (e.g., arrangement of paths and trees). ",European Deprivation Index (EDI),,,,,,,,,,,,Kendals tau test for correlation between park outcomes and deprivation,"In multivariable models, only the mean distance to the green spaces within 800 m (OR = 1.156, 95% CI: 1.099, 1.215) remained significantly and positively associated with the deprivation quintiles (larger distances in more deprived neighbourhoods). ","Our study suggest that there is a need to improve accessibility and quality green space in Porto, especially in the more socioeconomically deprived areas of the city.",https://www.web.uwa.edu.au/__data/assets/pdf_file/0003/411951/POST_Manual.pdf,
Juonala,2019,,Australia,cross-sectional,Park Access,Green Space,self-report,Are there good parks and playgrounds/play spaces?”,,,,,,,,,,,,,Linear regression models,Proximity to parks/playgrounds and shopping facilities was associated with dyslipidemia,"In conclusion, the present data show that among a population of children and adolescents with established severe obesity, neighbourhood advantage and living-related factors, such as walkability, are associated with less severe obesity.",,
Kamel,2014,El Paso,USA,cross-sectional,Park Access,Green Space,audit,Community Park Audit Tool (CPAT),Area level income,,Area level % foreign born,,,,,,,,,,ANOVA,"The number of park facilities (F = 10.21, p < 0.01) per tract differed significantly across income tertiles (Table 1). Specifically, the medium income tertile had significantly more facilities than the low (p < 0.01) or high (p = 0.02) income tertiles.The number of park aesthetic features did not differ significantly across either income (F = 0.29, p = 0.75) or percent foreign-born (F = 0.09, p = 0.91) tertiles .","Future research should consider policies which may contribute to or may rectify resource disparities across communities, as well as identify how access or lack thereof, to quality park environments affects physical activity and other health outcomes for at-risk populations.",https://www-sciencedirect-com.cyber.usask.ca/science/article/pii/S0749379711009032,
Lara-Valencia,2018,Pheonix - Mesa,USA,cross-sectional,Park Access,Green Space,audit,Public Open Space Audit Tool (POST),% Latino in three categories,,,,,,,,,,,,ANOVA,"There was a statistically significant difference between quartiles as determined by one-way ANOVA for shaded playgrounds (F = 12.49, p < .000); and other amenities, an aggregated score com- bining availability of architectural features, picnic tables and benches (F = 17.03, p < .000). There was a statistically significant difference between quartiles as determined by one-way ANOVA for a number of trees (F = 7.75, p < .000) and for dominant land uses (F = 2.91, p < .035).","This research has examined the spatial allocation of park space and services across neighbourhoods with different concentrations of Latino residents in Phoenix and Mesa, Arizona.",https://doi-org.cyber.usask.ca/10.1016/j.amepre.2010.10.024,
Marquet,2019,New York City,USA,cross-sectional,Park Access,Green Space,audit,System for Observing Play and Recreation in Communities (SOPARC),Focus in low income high % Latino areas,,,,,,,,,,,,Negative Binomial Regression,"Teenagers of both genders and most race/ethnicity groups were less likely to be in a park and had lower per capita energy expenditure, compared with children. The difference in park attendance was greater than the difference in per capita energy expenditure. Dissimilarities were clearly gendered and race/ethnicity dependent. Asian and Latino females showed the greatest divergence between childhood and adolescence. African American boys were the only group to show a positive age contrast in park attendance and per capita energy expenditure.","Overall, our study has demonstrated that there is an almost universal decline in park use among adolescents when compared with children 5–10 years old of the same demographic group.",https://doi-org.cyber.usask.ca/10.1123/jpah.3.s1.s176,
McCarthy,2017,Southeast County (no name given),USA,cross-sectional,Park Access,Green Space,audit,Community Park Audit Tool (CPAT),,,,,,,,,,,,,Multilevel logistic regression,"No differences in playground access according to gender or race/ethnicity, but that higher SES youth were nearly half as likely to have a playground within ½ mile [odds ratio (OR) = 0.60, confidence interval [95% CI] = 0.50–0.72; Table 2]. For the second research question, which included only those youth with a playground within ½ mile (n = 1844), there were no significant differences in higher vs. lower average playground quality by gender, SES, or race/ethnicity (Table 3).",,,
Panken,2015,Flint,USA,Case Control,Park Renovation,Green Space,audit,Parks and Play Spaces Direct Observation (PPSDO) tool and SOPARC,,,,,,,,,,,,,ANOVA,"Not only were the number of uses higher in intervention parks, but also the average park use per hour was higher in those same parks. Furthermore, individuals tended to be less sedentary and more moderately physically active in intervention parks than in comparison parks (chi-square statistic = 10.2251; P = .006). Thirty-two percent of the users in the intervention parks and 53% of users in the comparison parks were sedentary.","City of Flint parks have long been seen as underutilized community assets, but more recently parks have become a rallying point for the community to help revitalize Flint and provide places for active play.",PPSDO: http://www.transtria.com/enhanced_evaluation_resources.php,
Vert,2019,Barcelona,Spain,Case Control,Park Renovation,Green Space,audit,System for Observing Parks and Recreation in Communities (SOPARC),,,,,,,,,ICC,"the overall ICC between observers was 0.996 (95% CI; 0.994, 0.998), showing the highest agreement for activity level [0.998 (95% CI; 0.997, 0.999)], and the lowest agreement for ethnicity [0.866 (95% CI; 0.806, 0.908)].",,,Multinomial logistic regression,"Overall, more males were observed in the riverside area than females, both before and after the intervention. However, after the intervention, we observed a 43% increase in females at the renovated area of the river while the number of females decreased 26% in the non-renovated area. Although the intervention was designed to enable use by people of all 
physical abilities, we only observed 8 disabled users (6 in 2016 and 2 
in 2017) during the whole study period (data not shown).","We found that the urban riverside regeneration project undertaken in the Besòs Riverside Park in “La Ribera” neighbourhood in Montcada i Reixac, promoted the use of this area by improving the accessibility to the riverbanks. Results suggest a reduction in inequalities, mainly in the renovated area, in terms of gender and ethnicity.",,
Winter,2019,Los Angeles,USA,cross-sectional,Park Use,Green Space,audit,"SOPARC (or modified versions, such as SOPLAY or SOPARNA)",,,,,,,,,,,,,,"Males represented the majority (63.4%) of observed recreationists (Table 4), although they represented a larger proportion of visitors in the disadvantaged communities than in the affluent communities. he proportion of recreationists within each age group also varied significantly by community. Latinos were the predominant ethnic/racial group observed in the disadvantaged communities (93.9% overall, Table 4),
 and made up the largest proportion of ethnic group members observed 
(68.9%); Whites were the majority group (71.2%) observed in the affluent
 communities.","Future research focused on encouraging active park use, particularly in areas impacted by elevated risks from pollutants, may benefit from incorporating a nuanced approach",,
Yuma-Guerrero,2017,,Calfornia,cross-sectional,Park Access,Green Space,self-report,Respondents’ assessment of whether there are good parks or playgrounds in the neighborhood and whether respondents feel comfortable going to the park or playground closest to where she lives during the day. Both indicators are coded on a 4-point scale with higher levels indicating higher agreement.,,,,,,,,,,,,,Structural equation modelling,Park access significantly associated with Social Cohesion then to PA. ,"This study found social cohesion mediated the pathway between perceptions of safety to engagement in PA for a diverse sample of mothers, indicating neighborhood social cohesion may be a beneficial target for public health intervention.",,
Zenk,2020,Chicago,USA,natural experiment,Park Renovation,Green Space,audit,System for Observing Play and Recreation in Communities (SOPARC),,,,,,,,,,,,,Difference in Differences,"Whereas short-term changes in park use differed between renovated parks and comparison parks in low-income neighborhoods (b = − 0.787, p < 0.001), there was essentially no short-term change in park use in renovated parks in low-income neighborhoods (0.703 + − 0.787 = − 0.085, p = 0.33) (Table 2). The longer-term change in park use differed between renovated parks and comparison parks in low-income neighborhoods (− 0.666, p < 0.001), with park use decreasing longer term in renovated parks located in low-income neighborhoods (− 0.923, p < 0.001).",Our finding that positive impacts of playground renovations on park use and park-based MVPA were confined to higher income neighborhoods and low-percent Black neighborhoods suggests that complementary strategies may be needed to ensure renovations benefit all neighborhoods.,,
