first_author_last_name,year,city,country,study_design,intervention,metric,type of measure,measure,equity_group1,equity1_sample_size,equity_group2,equity2_sample_size,comparison_group,comparison_sample,comparison_group1,comparison_sample1,reliability,reliability_finding,validity,validity_finding,analysis,results ,conclusions,link_to_measure,notes
Zieff,2018,"Bogota, San Francisco and Temuco","Colombia, USA and Chile",pre-post (comparing a non-OS event day to OS event day),Open streets programs,Green Space,audit,"Survey part of the Stanford Neighborhood Discovery Tool: 25-item demographic/environmental observation survey ((e.g., cracks in sidewalks, sidewalk corner ramps, traffic calming facilities  gangs, homeless, garbage, graffiti).
Note that the Stanford Neighborhood Discovery Tool is technically a tablet or smartphone based participatory tool that incorporates photo and voice technology, GPS but also a more standard survey (described above)",area-level SES,"Bogotà: 32 adults from low-, middle- and high-income nbg",older adults (65-89 yrs-old),Temuco: 8 older adults,NA,NA,NA,NA,No,NA,No,NA,"Pre-post comparison of environmental characteristics, comparing non-event day to OS event day",No statistically significant differences in perceived environmental characteristics between sites (cities),"DT was a useful tool for training local citizen scientists to notice changes to the
built environment that support or interfere with PA.
The reported differences in results across sites suggests that the DT is sensitive enough to allow respondents to
report context-specific built environmental infrastructure as well as elements of OS initiatives that support
PA or that need improvement. ",https://www.sciencedirect.com/science/article/pii/S0749379712009361?via%3Dihub,Also included in the walkability/bikeability review
Blanchette,2020,"3 regions (Ottawa, Ontario; Vancouver, British Columbia; and Trois-Rivières, Québec)",Canada,multi-site cross sectional,N/A,Walkability,self-report questionnaire (parent & child),,,,,,,,,,,,,,,,,,
Hino ,2017,Curitiba,Brazil,cross-sectional,n/a,Walkability,self-report,Brazilian version of the Neighborhood Environment Walkability Scale-Abbreviated (A-NEWS).,,,,,,,,,yes - in this and in other studies,A-NEWS presented high reproducibility (test-retest with interval of 7-10 days between applications) with the lowest intraclass correlation coefficient of 0.67 (95% CI = 0.47-0.80) and the highest 0.95 (95% CI = 0.92-0.97).,yes other studies,,multilevel logistic binary model.,,,https://periodicos.ufsc.br/index.php/rbcdh/article/view/1980-0037.2017v19n5p596/35468,"A-NEWS is obtained by means of the perception of the predominant types of residences in the neighborhood and has as options of response a 5-point likert scale that ranges from “none” to “all”, with value 1 corresponding to answer op-tion “none” and five as the option “all”. For all other questions, the answer options  were  composed  of  a  4-point  likert  scale  with  “totally  disagree”,  “partly disagree”, “partly agree” and “totally agree” options. "
Casagrande,2011,"Baltimore City, Maryland",USA,cross-sectional,n/a,Walkability,audit,The Pedestrian Environment Data Scan (PEDS),low/diverse SES,"N=1231; 64% categorized as high SES, 36% low",diverse race,,,,,,yes,"A 5% reliability sample was conducted for each neighborhood where pairs of
raters assessed the same segments for quality
control purposes; j statistics were high, ranging
from 0.75 to 0.99 for most PEDS items.",not noted,,,"Among individuals living in predominately White and high-socioeconomic status (SES) neighborhoods, residing in highly walkable neighborhoods was associated with a lower prevalence of obesity when compared with individuals living in poorly walkable neighborhoods, after adjusting for individual-level demographic variables (prevalence ratio–[PR]=0.58; P=<.001 vs PR=0.80; P=.004). The association between walkability and obesity for individuals living in low-SES neighborhoods was not significant after accounting for main mode of transportation (PR=0.85; P=.060).","see results; ""more research needed""","PEDS:  Clifton K, Livi Smith AD, Rodriguez D. The development and testing of an audit for the pedestrian environment. Landsc Arch Urban Plan. 2006;80(1-2): 95–110.",Auditors worked in pairs and discrepancies were reconciled on-site
,,,,,,,,,,,,,,,,,,,,,,,,,
,,,,,,,,,,,,,,,,,,,,,,,,,
Douglas,2020,"South Los Angeles, California",USA,case study,n/a,Walkability,participatory mapping sessions,"participatory mapping sessions

Trained Community Coalition and PARC mapping facilitators and South Los Angeles residents convened at a local community center in March 2015 to map 1) resident walking routes to Helen Keller Park and 2) neighborhood characteristics (eg, streetlights, crime) associated with park access. This information would then be scaled up to 3) examine place-based determinants of health across South Los Angeles, and based on these results, 4) develop grassroots solutions for improving recreational access.

To achieve mapping objectives, as a collective group, residents were briefed on mapping procedures and informed that they could stop participating at any time. Participants then joined 1 of 4 contemporaneous, 1-hour mapping sessions, each with 8 to 12 participants. Two mapping sessions were organized according to resident location to account for geographic differences in resident experiences, a third session accommodated Spanish-language speakers, and a fourth session included community adolescents aged 15 to 18. In addition, public health officials and gang interventionists, who also possessed knowledge of the area, aided in session facilitation.

Facilitators began each session by reviewing mapping objectives. Participants were then geographically oriented to recognizable neighborhood institutions on the 4-by-5-foot paper street maps (Figure 1) to confirm participant map awareness. Following this step, participants were asked to identify their walking and public transportation routes to Helen Keller Park and neighborhood assets (eg, streetlights) and challenges (eg, crime) that may encourage or encumber resident mobility. Mapping facilitators traced resident mobility routes, marking assets and challenges along each route. Notes were also recorded on paper to capture resident concerns that could not be mapped. Then, participants reconvened into the collective group to review overarching themes and provide an opportunity for participants to add any additional points missed during breakout sessions. Participants were offered dinner after the event.",diverse race,,disadvanataged communities,,,,,,n/a,,n/a,,"digitize maps, review, scale maps",case study - focussed on benefits of participant mapping,"The case example presented here involved community residents and organizers, gang interventionists, public health and park officials, and health disparities researchers in collaboratively identifying research methods and procedures using the skills and expertise of our collective partnership. The resulting mixed-methods PGIS approach combined qualitative participatory mapping techniques involving reference maps with quantitative GIS analyses to connect resident spatial, contextual knowledge (primary data) with crime data (secondary data) to empirically confirm their experiences of place. These empirical data accordingly supported resident advocacy efforts that resulted in a major policy win that could limit proliferation of tobacco shops in Los Angeles County. We thus contend that participatory mapping is a powerful, visual mechanism of knowledge production for 1) diagnosing fundamental causes of health and disease, and 2) empowering disadvantaged communities to redress systemic inequities that manifest in health disparities through community organizing and policy change initiatives grounded in resident knowledge of place (8,9).",,